{
  "id": "ARCH-DB-001",
  "description": "Design a multi-region PostgreSQL architecture with failover, migration strategy and explicit consistency trade-offs, then implement the accepted migration tooling.",
  "files": ["src/db/", "migrations/"],
  "risk_factors": {
    "database_change": true,
    "migration": true,
    "persistence": true
  },
  "acceptance_criteria": [
    "Architecture decision documents consistency and rollback trade-offs.",
    "Migration implementation has deterministic tests.",
    "Independent review and verification use a comparable alternate model when available."
  ]
}
