{
  "id": "TASK-20260902-push-pr",
  "description": "Please push the local repository changes to the remote and create the pull request",
  "request": {
    "original_text": "podrias subir los cambios que tenemos en el repositorio, y crear el PR",
    "original_language": "es",
    "canonical_english": "Please push the local repository changes to the remote and create the pull request",
    "translation": {
      "equivalence_claim": "EXACT_INTENT",
      "back_translation": "Por favor, sube los cambios locales del repositorio al remoto y crea la pull request",
      "validation": {
        "ok": true,
        "issues": [],
        "source_invariants": {
          "code_blocks": [],
          "urls": [],
          "file_paths": [],
          "numbers": [],
          "identifiers": [],
          "quoted_literals": [],
          "has_negation": false,
          "has_strict_constraint": false
        },
        "canonical_invariants": {
          "code_blocks": [],
          "urls": [],
          "file_paths": [],
          "numbers": [],
          "identifiers": [],
          "quoted_literals": [],
          "has_negation": false,
          "has_strict_constraint": false
        }
      }
    }
  },
  "acceptance_criteria": [
    "All current local changes (untracked/modified files) are committed and pushed to remote origin",
    "A pull request is created on GitHub and its URL is returned",
    "No secrets, tokens or credentials are committed (verified via git diff and .gitignore)",
    "Remote branch reflects the pushed commit(s)"
  ],
  "risk_factors": {
    "touches_auth": false,
    "touches_production": false,
    "uses_secrets": false,
    "destructive_operation": false,
    "irreversible_change": false,
    "security_boundary": false,
    "schema_change": false,
    "database_change": false,
    "concurrency": false,
    "financial": false,
    "external_contract": false,
    "migration": false,
    "persistence": false,
    "important_calculation": false,
    "bug_fix": false
  },
  "files": [],
  "tags": [
    "git",
    "pr",
    "orchestrator-delegation"
  ]
}
